{"protocolVersion":1,"sessionId":"018f1f32-7abc-7def-8abc-0123456789ab","epoch":0,"eventId":"018f1f32-7abd-7def-8abc-0123456789ab","type":"session.start","monotonicMs":1,"payload":{"sessionSeed":"018f1f32-7abe-7def-8abc-0123456789ab","reasoningMode":"full","settings":{"version":1,"persona":"You are Oliver, a late-night radio host.","voice":{"catalogId":"catalog","voiceId":"af_heart"}}}}
