{"protocolVersion":1,"sessionId":"018f06b5-3c8d-7b2a-9f35-8b3388a857f1","epoch":2,"eventId":"018f06b5-3c8d-7b2a-9f35-8b3388a857f3","monotonicMs":1000,"type":"tts.ended","payload":{"responseId":"018f06b5-3c8d-7b2a-9f35-8b3388a857f6","playbackId":"018f06b5-3c8d-7b2a-9f35-8b3388a857f4","generatedSamples":6400}}
