{
  "protocolVersion": 1,
  "sessionId": "018f06b5-3c8d-7b2a-9f35-8b3388a857f1",
  "epoch": 2,
  "eventId": "018f06b5-3c8d-7b2a-9f35-8b3388a857f3",
  "monotonicMs": 1000,
  "type": "failure",
  "payload": {
    "code": "reasoning_invalid",
    "detail": "Reasoning output was invalid.",
    "correctiveAction": "Continue listening.",
    "recoverable": true
  }
}
