{"protocolVersion":1,"sessionId":"018f06b5-3c8d-7b2a-9f35-8b3388a857f1","epoch":2,"eventId":"018f06b5-3c8d-7b2a-9f35-8b3388a857f3","monotonicMs":1000,"type":"policy.decision","payload":{"turnId":"018f06b5-3c8d-7b2a-9f35-8b3388a857f5","policyVersion":"v1.experimental","eligible":true,"posture":"question","reasonCodes":["selected"],"inputDigest":"aaaaaaaaaaaaaaaaaaaaaaaaaaaaaaaaaaaaaaaaaaaaaaaaaaaaaaaaaaaaaaaa"}}
