{"protocolVersion":1,"sessionId":"018f06b5-3c8d-7b2a-9f35-8b3388a857f1","epoch":2,"eventId":"018f06b5-3c8d-7b2a-9f35-8b3388a857f3","monotonicMs":1000,"type":"budget.mitigation","payload":{"turnId":"018f06b5-3c8d-7b2a-9f35-8b3388a857f5","responseId":"018f06b5-3c8d-7b2a-9f35-8b3388a857f6","kind":"stall_target","detail":{"estimates":{"stallFirstDeltaMs":1500,"stallTextMs":4000,"bodyFirstPartMs":8000,"ttsTtfaMs":1000,"ttsRtf":0.3,"wordsPerSecond":2.5},"trigger":"target=27 words; penalty=0ms"}}}
